f1,f2,sim
rappresentazione   significato e significante,la rappresentazione,0.7173915
la rappresentazione,la rappresentazione dell informazione,0.8361824
spiegare nuovi concetti relativi l algoritmo,rappresentazione,0.38747346
rappresentazione,il sistema binario e la rappresentazione dell inform,0.5206791
rappresentazione,rappresentazione delle informazioni,0.6871167
rappresentazione delle informazioni,rappresentazione delle informazioni,0.99999994
rappresentazione delle informazioni,serve una rappresentazione corretta per ogni algoritmo,0.693344
serve una rappresentazione corretta per ogni algoritmo,rappresentazione informatica,0.66142935
codice binario,la rappresentazione e il codice binario,0.80711484
la rappresentazione e il codice binario,rappresentazione giusta dei numeri per procedere ad un algoritmo efficiente atto alla risoluzione del problema,0.77524
rappresentazione giusta dei numeri per procedere ad un algoritmo efficiente atto alla risoluzione del problema,rappresentazione di un algoritmo,0.85386723
rappresentazione di un algoritmo,rappresentazione dell informazione,0.6921751
rappresentazione corretta,l efficienza dei logaritmi con il sistema decimale posizionale e l importanza della rappresentazione,0.60040563
l efficienza dei logaritmi con il sistema decimale posizionale e l importanza della rappresentazione,rappresentazioni dell informazione,0.61365914
i numeri sono simboli e possono avere significante diverso in base al sistema utilizzato,la rappresentazione,0.6382084
la rappresentazione,come rappresentare l informazione,0.63567317
come rappresentare l informazione,rappresentazione,0.4507469
rappresentazione,la rappresentazione,0.88581145
chiarire i concetti base,rappresentazione,0.38395533
rappresentazione,rappresentazione dei numeri naturali,0.6753652
rappresentazione dei numeri naturali,come si possono scrivere i numeri,0.75218093
come si possono scrivere i numeri,capire l importanza di una corretta rappresentazione dei dati,0.74856657
capire l importanza di una corretta rappresentazione dei dati,la rappresentazione,0.75153285
la rappresentazione,rappresentazione numerica,0.6943827
rappresentazione numerica,significati e significanti  calcolo binario e algoritmi,0.5136268
significati e significanti  calcolo binario e algoritmi,rappresentazione dell informazione,0.575085
rappresentazione dell informazione,caratteristiche della rappresentazione  linguaggio naturale e codice binario,0.6577945
rappresentazione di numeri,rappresentazione dell informazione,0.70002633
rappresentazione dell informazione,rappresentazione dell informazione e diversi tipologie di rappresentazione,0.882943
rappresentazione dell informazione e diversi tipologie di rappresentazione,numeri,0.37011766
la rappresentazione dell informazione,rappresentazione dell informazione,0.9724373
rappresentazione dell informazione,definizioni di variabili,0.48963368
definizioni di variabili,basi di python,0.50639546
basi di python,significato  significante  rappresentazione decimale  numeri decimali posizionali,0.48354918
significato  significante  rappresentazione decimale  numeri decimali posizionali,variabili in python,0.54408306
variabili in python,basi del linguaggio python,0.8079061
basi del linguaggio python,i tipi di variabili   float int stringa,0.5916989
i tipi di variabili   float int stringa,variabili in python,0.71312654
variabili in python,variabili in python,1.0
variabili in python,spiegazione del concetto delle variabili in python,0.8771976
spiegazione del concetto delle variabili in python,operazioni,0.35337168
operazioni,linguaggio python,0.18927285
variabili in python,i primi linguaggi di programmazione,0.63328433
i primi linguaggi di programmazione,operazioni con con stringhe e numeri interi e razionali,0.66453093
operazioni con con stringhe e numeri interi e razionali,variabili intere  float e stringhe,0.8362236
variabili in python,imparare alcuni comandi e linguaggi di phyton,0.62397254
imparare alcuni comandi e linguaggi di phyton,cominciare ad usare python,0.698236
cominciare ad usare python,python,0.7986237
python,tipi di variabile,0.25280458
tipi di variabile,tipi delle variabili e operazioni,0.83932376
tipi delle variabili e operazioni,variabili python,0.5871368
variabili python,concetto di variabile e sue tipologie,0.5376249
concetto di variabile e sue tipologie,tipi di variabili nel linguaggio python,0.7766211
tipi di variabili nel linguaggio python,sintassi e semantica in python,0.8464045
sintassi e semantica in python,tipi di variabili nel linguaggio python,0.8464045
tipi di variabili nel linguaggio python,variabili python,0.8725095
variabili python,linguaggio python,0.84263754
linguaggio python,stringhe,0.34178117
stringhe,si,0.11299945
si,tipi di variabili e operazioni,0.51811296
tipi di variabili e operazioni,tipi di variabile e operazioni tra variabili,0.97256196
tipi di variabile e operazioni tra variabili,tipi di variabile e operazioni tra variabili,1.0000001
descrivere le variabili in python,le variabili in phyton,0.8220808
le variabili in phyton,stringhe  variabili,0.7810682
stringhe  variabili,struttura delle frasi che si possono usare per dare comandi in python,0.6155301
struttura delle frasi che si possono usare per dare comandi in python,variabili e stringhe,0.6003554
variabili e stringhe,variabili in python,0.6822237
variabili in python,variabili int  float  stringa,0.68936706
variabili int  float  stringa,linguaggio python,0.46764022
linguaggio python,tipo di variabili reali float stringhe e usarle,0.4823536
tipo di variabili reali float stringhe e usarle,iniziare a usare python,0.64179707
iniziare a usare python,primi approcci a python,0.83960086
primi approcci a python,primi passi per utilizzare python,0.8863213
primi passi per utilizzare python,linguaggio informatico,0.5113247
linguaggio informatico,variabili in python,0.49202406
variabili in python,come utilizzare la variabile durante una programmazione,0.6813414
come utilizzare la variabile durante una programmazione,variabili  operazioni stringhe operazioni stringa valore,0.6611541
variabili  operazioni stringhe operazioni stringa valore,linguaggio in python,0.48134723
linguaggio in python,variabili,0.38064557
variabili,sintassi e semantica in python,0.45318177
sintassi e semantica in python,tipi di variabili e come usarle su phyton,0.59055644
utilizzo python,tipi di variabili,0.44175258
gestione delle variabili su phyton,come utilizzare le variabili attraverso python,0.7782738
come utilizzare le variabili attraverso python,programmazione python,0.69235736
programmazione python,variabili e la programmazione,0.64137685
variabili e la programmazione,prime istruzioni di python,0.6392347
prime istruzioni di python,stringhe,0.36481038
variabili  errori e convenzioni nel linguaggio di python con definizione di stringa,come usare una variabile,0.77475744
come usare una variabile,assegnazione e operazioni tra variabili con il linguaggio python,0.7515818
come definire le variabili e abbiamo iniziato a fare la programmazione python,concetti di base di programmazione,0.8371334
concetti di base di programmazione,stringa e prime operazioni con python,0.7098539
stringa e prime operazioni con python,tipi di variabili e operazioni su phyton,0.7588181
tipi di variabili e operazioni su phyton,python,0.29080132
python,inizio uso python,0.8498027
inizio uso python,uso delle variabili,0.56897914
uso delle variabili,linguaggio phyton,0.5729749
linguaggio phyton,operazioni in python,0.53513545
operazioni in python,comincia ad usare python,0.7977325
comincia ad usare python,concetti di base di variabili e stringhe nel linguaggio python  operazioni ed errori,0.7254104
concetti di base di variabili e stringhe nel linguaggio python  operazioni ed errori,introduzione al linguaggio di python  le variabili,0.92404574
introduzione al linguaggio di python  le variabili,variabili con python   stringhe somma numeri interi e reali float,0.8498413
variabili con python   stringhe somma numeri interi e reali float,inizio programmazione,0.5421923
inizio programmazione,variabili  tipi diversi  operazioni diverse,0.5000872
variabili  tipi diversi  operazioni diverse,variabile  diversi tipi di variabili interi float  stringhe   semantica e sintassi  in python non sono specificati i tipi delle variabili  operazioni delle variabili  somma delle stringhe  concatenazione   moltiplicazione tra numero e stringa,0.90531635
variabile  diversi tipi di variabili interi float  stringhe   semantica e sintassi  in python non sono specificati i tipi delle variabili  operazioni delle variabili  somma delle stringhe  concatenazione   moltiplicazione tra numero e stringa,distinzione tra variabili numeriche  intere o reali  e stringhe,0.9376948
distinzione tra variabili numeriche  intere o reali  e stringhe,dichiarazione e tipi di variabili in python,0.8111182
dichiarazione e tipi di variabili in python,vari tipi variabili per il programma python,0.9317084
vari tipi variabili per il programma python,calcoli,0.40090647
calcoli,python  le prime istruzioni,0.3900184
python  le prime istruzioni,operazioni tra stringhe e spazi,0.60701984
operazioni tra stringhe e spazi,caratteristiche principali e convenzioni del linguaggio python,0.65517104
caratteristiche principali e convenzioni del linguaggio python,linguaggio phyton,0.7341505
linguaggio phyton,linguaggio python,0.73184985
linguaggio python,introduzione del linguaggio python,0.91609114
introduzione del linguaggio python,vari modi di rappresentare una stessa informazione,0.5617809
vari modi di rappresentare una stessa informazione,variabili in python  interi  float  stringhe,0.6446365
variabili in python  interi  float  stringhe,tipi di variabili,0.73382705
tipi di variabili,primi approcci con python  operazioni con i numeri e definizione di stringa,0.7175795
primi approcci con python  operazioni con i numeri e definizione di stringa,primi approcci con python,0.8360804
primi approcci con python,primo approccio con python,0.91329366
primo approccio con python,variabili in python  tipi int float e stringhe,0.7551685
variabili in python  tipi int float e stringhe,differenza tra sintassi e semantica  come utilizzare le variabili in phyton  tipi di di variabili,0.84246594
differenza tra sintassi e semantica  come utilizzare le variabili in phyton  tipi di di variabili,variabili in python  stringa  numeri reali  numeri interi,0.82341564
variabili in python  stringa  numeri reali  numeri interi,fondamenti sulla scrittura delle variabili in python in base al loro tipo  numeri interi o reali  stringe   operazioni tra tipi diversi di variabili  osservazione degli errori comuni e delle convenzioni per la scrittura,0.8616301
fondamenti sulla scrittura delle variabili in python in base al loro tipo  numeri interi o reali  stringe   operazioni tra tipi diversi di variabili  osservazione degli errori comuni e delle convenzioni per la scrittura,cosa sono le variabili e come utilizzarle per fare delle operazioni con esse,0.9151931
cosa sono le variabili e come utilizzarle per fare delle operazioni con esse,oggi abbiamo utilizzato il web per vedere le variabili e le stringhe avevo il pc e devo dire che la lezione essere stata oltre che interessantissima anche molto produttiva in quanto si entra nel vivo  preferisco questo tipo di metodo di insegnamento alla tradizionale spiegazione che essere meno interattiva  grazie prof,0.90407115
oggi abbiamo utilizzato il web per vedere le variabili e le stringhe avevo il pc e devo dire che la lezione essere stata oltre che interessantissima anche molto produttiva in quanto si entra nel vivo  preferisco questo tipo di metodo di insegnamento alla tradizionale spiegazione che essere meno interattiva  grazie prof,variabili in python e vari esempi di stringhe,0.79259944
variabili in python e vari esempi di stringhe,iniziare a prendere dimestichezza con python,0.736616
iniziare a prendere dimestichezza con python,variabili in python,0.7155951
variabili in python,interessante  ma in certi casi noiosa,0.5417591
interessante  ma in certi casi noiosa,linguaggio e struttura semantica e sintattica,0.5956737
linguaggio e struttura semantica e sintattica,programma online python tutor,0.48772758
programma online python tutor,capire come definire le variabili in python,0.67231023
capire come definire le variabili in python,linguaggio di programmazione python,0.7650854
linguaggio di programmazione python,sintassi e semantica  errori  convenzioni  operatori matematici  stringhe,0.6657472
sintassi e semantica  errori  convenzioni  operatori matematici  stringhe,concetti iniziali di python,0.6866714
concetti iniziali di python,sintassi semantica e variabili in python,0.81136274
calcoli si payton,condizioni,0.39573967
condizioni,le condizioni per il funzionamento di un programma,0.58366436
le condizioni per il funzionamento di un programma,le condizioni,0.77978027
le condizioni,condizioni,0.8745572
condizioni,condizioni,1.0000001
condizioni,condizioni e linguaggio informatico,0.5625237
condizioni e linguaggio informatico,le condizioni,0.6339713
le condizioni,le condizioni,1.0000001
le condizioni,condizioni,0.8745572
condizioni,inizio uso python,0.26881784
inizio uso python,le condizioni,0.36613703
condizione and or e not,condizioni,0.35172614
condizioni,condizioni nelle programmazione,0.61577934
condizioni nelle programmazione,condizioni per python,0.66178626
condizioni,condizioni e asserzioni,0.7119243
condizioni e asserzioni,condizioni,0.7119243
condizioni,condizioni,1.0000001
condizioni,condizioni and or e not,0.45976594
condizioni and or e not,condizioni e funzioni di interpretazione,0.62079185
condizioni e funzioni di interpretazione,le condizioni,0.7882006
le condizioni,condizioni,0.8745572
condizioni,condizioni,1.0000001
condizioni,il concetto di condizione e asserzione,0.43951535
il concetto di condizione e asserzione,condizioni,0.43951535
condizioni,condizioni e asserzioni,0.7119243
condizioni  if  else  and  or  logica,le diverse condizioni in python  come inserirle e dividerle in blocchi   i connettivi logici,0.78690934
le diverse condizioni in python  come inserirle e dividerle in blocchi   i connettivi logici,condizioni,0.45920113
condizioni,logica e condizioni,0.7117534
logica e condizioni,scrittura condizioni,0.6969201
scrittura condizioni,condizioni e connettivi logici,0.5655832
programmazione in python  if else  and  or  not,le condizioni,0.38789913
le condizioni,le condizioni di programmazione,0.80290014
le condizioni di programmazione,condizioni,0.6389059
condizioni,condizioni con uso di if then else  uso di and or not,0.3699994
condizioni con uso di if then else  uso di and or not,condizioni e parole   e o no,0.73005265
condizioni e parole   e o no,le condizioni,0.65509236
le condizioni,basi di python,0.43737793
basi di python,gli if else,0.39439517
gli if else,le condizioni e la logica applicata a queste,0.45022812
le condizioni e la logica applicata a queste,condizioni e logica,0.8853465
condizioni e logica,le condizioni,0.7764483
le condizioni,condizioni e diagrammi di flusso,0.73226935
condizioni e diagrammi di flusso,capire le condizioni,0.7244252
capire le condizioni,condizioni,0.7877558
condizioni,le condizioni e il linguaggio logico,0.5549663
le condizioni e il linguaggio logico,condizioni dei codici,0.6679304
condizioni dei codici,print in python e prime condizioni,0.5866047
print in python e prime condizioni,le condizioni e i connettivi logici,0.6631089
le condizioni e i connettivi logici,le condizioni e i connettivi logici,0.9999999
le condizioni e i connettivi logici,programmare con linguaggio python,0.5578114
programmare con linguaggio python,il concetto di condizione e asserzione,0.55642754
il concetto di condizione e asserzione,le condizioni,0.5917308
le condizioni,condizioni  if  else   logica  and  or  not  xor,0.46665537
condizioni  if  else   logica  and  or  not  xor,condizioni nel linguaggio di programmazione,0.6782698
condizioni nel linguaggio di programmazione,imparare le condizioni if,0.65786153
imparare le condizioni if,condizioni di esistenza e logica,0.6553302
condizioni di esistenza e logica,variabili  tipi diversi  operazioni diverse,0.69698405
variabili  tipi diversi  operazioni diverse,condizione,0.36297792
condizione,espressioni condizionali e connettivi logici,0.42893562
espressioni condizionali e connettivi logici,condizioni,0.34138024
condizioni  if  else  tabelle di verita  dei connettivi logici,condizioni  nessi logici  codici con if e else,0.9287203
l importanza delle condizioni,condizione  operatori logici  importanza dell aggregazione delle condizioni in python,0.73838717
condizione  operatori logici  importanza dell aggregazione delle condizioni in python,if  else,0.52690417
primi passi in python,primi passi in python,1.0000001
primi passi in python,le condizioni,0.39723787
le condizioni,le condizioni,1.0000001
le condizioni,condizioni,0.8745572
condizioni,condizioni,1.0000001
condizioni,condizioni,1.0000001
condizioni,cicli,0.26083362
cicli  funzione while e definizioni di altre funzioni,cicli,0.537067
cicli,cicli,0.9999999
cicli,i cicli,0.8903388
i cicli,i cicli,0.99999994
i cicli,i cicli,0.99999994
i cicli,i cicli,0.99999994
i cicli,i cicli,0.99999994
i cicli,cicli,0.8903388
cicli,linguaggio python,0.2426247
linguaggio python,cicli con while,0.40450442
cicli con while,condizioni e decisioni  cicli funzioni,0.6447636
condizioni e decisioni  cicli funzioni,i cicli,0.6841485
i cicli,cicli,0.8903388
cicli,i cicli,0.8903388
i cicli,cicli,0.8903388
cicli,ciclo while,0.62925684
ciclo while,cicli,0.62925684
cicli,base di programmazione,0.31767648
base di programmazione,i cicli,0.47828925
i cicli,cicli,0.8903388
cicli,cicli,0.9999999
cicli,concetto di cicli,0.823054
concetto di cicli,ciclo while,0.62718266
ciclo while,ciclo,0.73580784
ciclo,ciclo,0.9999999
ciclo,cicli,0.7611917
cicli,while,0.27000296
while,i cicli,0.3268746
i cicli,i cicli,0.99999994
i cicli,cicli,0.8903388
cicli,imparare a conoscere il linguaggio della programmazione,0.35175115
imparare a conoscere il linguaggio della programmazione,ciclo while,0.45893806
ciclo while,cicli,0.62925684
cicli,cicli,0.9999999
cicli,cicli  loops,0.6392138
cicli  loops,cicli,0.6392138
cicli,ciclo while,0.62925684
ciclo while,ciclo while  esercizi ed errori,0.7579016
ciclo while  esercizi ed errori,cicli,0.53513354
cicli,attenzione ai dettagli,0.27005735
attenzione ai dettagli,i cicli,0.47392255
i cicli,cicli,0.8903388
cicli,spiegare il funzionamento dei cicli,0.70425487
spiegare il funzionamento dei cicli,cicli,0.70425487
cicli,cicli,0.9999999
cicli,spiegazione dei cicli,0.786332
spiegazione dei cicli,funzione del while,0.49808407
funzione del while,capire come funzionano i cicli,0.5888914
capire come funzionano i cicli,i cicli e l uso di while,0.78639734
i cicli e l uso di while,cicli,0.5956877
cicli,cicli,0.9999999
cicli,cicli,0.9999999
cicli,cicli while,0.75355613
cicli while,programmi con somma e media,0.3924918
programmi con somma e media,cicli,0.3321375
cicli,spiegazione dei cicli,0.786332
spiegazione dei cicli,cicli,0.786332
i cicli  while,e  stato la spiegazione dei cicli,0.7826797
e  stato la spiegazione dei cicli,cicli,0.52676195
cicli,cicli,0.9999999
cicli,i cicli,0.8903388
i cicli,ciclo while,0.6227139
ciclo while,cicli  e prime programmazioni,0.5745777
cicli  e prime programmazioni,basi di programmazione,0.6549326
basi di programmazione,cicli e nuove funzioni d immissione,0.5825643
cicli e nuove funzioni d immissione,cicli,0.5881683
cicli,i cicli,0.8903388
i cicli,funzionamento dei cicli,0.86333984
funzionamento dei cicli,ciclo while,0.59819925
ciclo while,i cicli,0.6227139
i cicli,funzionamento dei cicli,0.86333984
funzionamento dei cicli,ciclo while e riconoscimento codice esatto,0.6542036
ciclo while e riconoscimento codice esatto,cicli  importanza delle condizioni nel ciclo  istruzioni in python,0.7960208
cicli  importanza delle condizioni nel ciclo  istruzioni in python,i cicli,0.73966306
i cicli,inizio programmazione,0.41934136
inizio programmazione,struttura del corpo dei cicli e funzionamento  while  dizionario funzioni e esempi di problemi e soluzioni,0.5502567
ciclo while spiegato bene,primi esercizi,0.33804396
primi esercizi,ciclo,0.22297767
ciclo,cicli con while,0.5897034
cicli con while,imparare a programmare,0.47741264
imparare a programmare,cicli,0.30016437
cicli,cicli e relativi esercizi,0.7091386
cicli e relativi esercizi,i cicli con while,0.702478
i cicli con while,cicli loops    while,0.86090964
condizioni e formule logiche  if  else  and  or  not,cicli  while    funzione print e funzione input,0.8489826
cicli  while    funzione print e funzione input,spiegare i cicli  loops,0.8289179
spiegare i cicli  loops,ciclo loops,0.70269144
ciclo loops,i cicli  while,0.5940554
i cicli  while,cicli while,0.800642
cicli while,utilizzo dei cicli  ricerca e conteggio nelle stringhe di caratteri,0.5565977
utilizzo dei cicli  ricerca e conteggio nelle stringhe di caratteri,esercizi con i cicli,0.75238043
esercizi con i cicli,tutoraggio,0.35851493
tutoraggio,esercitazione,0.19993967
esercitazione,descrizione di alcune funzioni,0.32509845
descrizione di alcune funzioni,esercitazione,0.32509845
esercitazione,esercitazione su loop python,0.59660965
esercitazione su loop python,meccanismo della dimostrazione,0.48589516
meccanismo della dimostrazione,logica e struttura di un elaboratore,0.69783556
logica e struttura di un elaboratore,cenni di logica,0.7609531
concetto di dimostrazione  calcolatore von neumann,logica dietro le dimostrazioni,0.6529272
logica dietro le dimostrazioni,tavole di verita e la memoria,0.6037768
tavole di verita e la memoria,logica memoria e algoritmo vitale,0.6692758
logica e organizzazione della memoria,la logica dietro le dimostrazioni  architettura e funzionamento di un elaboratore  organizzazione della memoria  cpu e algoritmo vitale,0.8789587
logica e regole di inferenza,algoritmi vitali  la logica  elaborazioni,0.75989485
algoritmi vitali  la logica  elaborazioni,von neumann memoria e cpu,0.6469553
von neumann memoria e cpu,condizioni  if  else  and  or  logica,0.52636796
condizioni  if  else  and  or  logica,principi di logica e funzionamento della macchina di von neumann introduzione alla memoria,0.6951837
principi di logica e funzionamento della macchina di von neumann introduzione alla memoria,logica  cpu  algoritmo vitale,0.741439
algoritmi vitali,algoritmo vitale,0.7013556
algoritmo vitale,logica e rappresentazione dei numeri,0.52346617
logica e rappresentazione dei numeri,connettivi memoria cpu algoritmo vitale,0.6063894
connettivi memoria cpu algoritmo vitale,logica e algoritmo vitale,0.84994286
logica e algoritmo vitale,logica  organizzazione della memoria  algoritmo vitale,0.87307745
logica  organizzazione della memoria  algoritmo vitale,riassunto,0.3698765
riassunto,tabella di verita,0.39479986
tabella di verita,modus ponens e bit,0.53368837
logica  dimostrazioni  cpu,logica e dimostrazioni,0.8166977
logica e dimostrazioni,modus ponens  algoritmo vitale  bit e byte,0.58683014
principi di logica,logica,0.7938167
logica,cenni di logica,0.7151942
algoritmo vitale,principi di logica  memoria bit e byte,0.61318463
principi di logica  memoria bit e byte,algoritmo vitale,0.61318463
algoritmo vitale,logica memoria e algoritmi,0.6856706
logica memoria e algoritmi,logica  semantica e sintassi  cpu  memoria  algoritmo vitale,0.86251146
algoritmo vitale  macchina di von neumann  sintassi  numeri reali,capire gli algoritmi per svolgere i programmi,0.7543355
l utilizzo della logica proposizione  l architettura di un elaboratore  macchina di von neumann  e algoritmo vitale,logica,0.5434217
cenni di logica,introduzione alla logica,0.74612
introduzione alla logica,cenni di logica  modus ponendo  algoritmo vitale,0.72823095
cenni di logica  modus ponendo  algoritmo vitale,spiegazione degli connettivi logici,0.62648314
spiegazione degli connettivi logici,concetti di logica,0.7326024
concetti di logica,dimostrazione,0.49443638
dimostrazione,i sistemi logici,0.42377204
i sistemi logici,cenni di logica e rappresentazione numerica,0.61235774
chiarimento and   or   architettura di un elaboratore   organizzazione della memoria   operazioni della memoria cpu algoritmo vitale,architettura macchina von neumann,0.5849208
logica e macchina di von neumann,logica e algoritmo vitale,0.68853277
logica e algoritmo vitale,sintassi   semantica  assiomi  cpu,0.67903924
sintassi   semantica  assiomi  cpu,principi di logica,0.6421617
principi di logica,ciclo for,0.35769174
ciclo for,ciclo for e cicli innestati,0.8722426
ciclo for e cicli innestati,ciclo for,0.8722426
ciclo for,ciclo for e cicli innestati,0.8722426
ciclo for e cicli innestati,ciclo for,0.8722426
ciclo for,ciclo for e ciclo innestato,0.9038055
ciclo for e ciclo innestato,ciclo for,0.9038055
ciclo for,ciclo  for,0.83522254
ciclo  for,ciclo for,0.83522254
ciclo for,i cicli in particolare il ciclo for,0.8439307
i cicli in particolare il ciclo for,cicli for,0.84160113
cicli for,i cicli,0.7655502
i cicli,cicli,0.8903388
cicli,ciclo for,0.6274866
ciclo for,ciclo for,1.0
ciclo for,ciclo for,1.0
ciclo for,cicli for,0.89042413
cicli for,ciclo for,0.89042413
ciclo for,cicli for,0.89042413
cicli for,cicli for,1.0
cicli for,ciclo for,0.89042413
ciclo for,ciclo for,1.0
ciclo for,ciclo for,1.0
ciclo for,cicli while e for,0.8332476
cicli while e for,ciclo for,0.8332476
ciclo for,ciclo for,1.0
ciclo for,cicli for,0.89042413
cicli for,ciclo for,0.89042413
ciclo for,for,0.74395365
for,cicli for e nested loops,0.706316
cicli for e nested loops,ciclo for,0.7917695
ciclo for,il ciclo for,0.958182
il ciclo for,ciclo for,0.958182
ciclo for,costrutto for e esercizi,0.56414366
costrutto for e esercizi,ciclo for,0.56414366
ciclo for,ciclo for,1.0
ciclo for,ciclo for,1.0
ciclo for,ciclo for,1.0
ciclo for,ciclo for,1.0
ciclo for,ciclo for,1.0
ciclo for,ciclo for,1.0
ciclo for,ciclo for e concetto di range,0.81651294
ciclo for e concetto di range,cicli for,0.76070714
